{"problem_number":"1107","review_model":"GPT-5.5","review_type":"one_problem_model_review","verdict_zh":"GPT-5.5 级别模型配合计算、形式化证明和检索工具，较可能对该问题做出有价值的局部推进或验证框架，但直接完成全称证明的概率偏低。更现实的目标是：固定小 r 的大规模反例搜索、局部同余障碍排除、r-powerful 数的结构化分解与表示函数实验，以及为潜在解析数论证明整理可机检的中间引理。","level":"low_to_medium_candidate","score":42,"confidence":"medium","likely_route_zh":"可行路线是把 r-powerful 数按素因子指数至少为 r 的条件转化为可枚举或可参数化的结构，研究表示函数 R_{r+1}(N)，先对固定小 r 做模素幂残基覆盖与大范围计算搜索，再尝试用圆法、筛法或局部到全局框架证明表示函数最终为正。形式化证明工具适合验证定义、分解引理、同余覆盖和计算证书，但解析估计本身仍需要强人工数学洞察。","supporting_reasons_zh":["问题定义短且结构明确，适合自动化生成 r-powerful 数、表示搜索和模运算验证。","题面备注给出 r=2 情形已成立，说明命题方向不是明显错误，也存在可借鉴的解析数论先例。","r-powerful 数的计数规模启发了 r+1 个加数作为自然阈值，计算实验可以较好地检验是否存在局部或小范围反例。","formalized=yes 表明至少题目层面的形式化入口存在，有助于把计算证书和基础引理纳入证明检查。","模型可辅助建立多层验证：枚举生成器正确性、残基类覆盖、候选反例搜索、以及表示函数统计。"],"main_obstacles_zh":["核心难点不是定义或计算，而是证明所有充分大的整数都有表示；这通常需要很强的解析数论估计。","r+1 个加数处在接近临界的稀疏加性基问题范围，简单密度启发不足以给出证明。","需要控制所有大整数，而不是平均意义或随机样本；反例搜索无法替代最终证明。","对任意 r 的统一论证比固定小 r 更难，参数增长会使同余、奇异级数和误差项控制复杂化。","现有形式化系统通常难以直接承载高强度圆法或筛法证明，形式化更可能用于局部组件而非完整解析证明。"],"validation_needed_zh":["为固定 r 验证 r-powerful 数生成器与结构分解的正确性。","系统检查模 p^k 下 r-powerful 数的 r+1 重和是否覆盖必要残基类，排除局部障碍。","对小 r 做可复现实验，记录最大未表示数候选、表示数量增长和异常残基模式。","若提出解析证明，需要独立验证主项正性、误差项界、奇异级数非零性和参数对 r 的依赖。","若使用计算证书，需要把枚举边界、模数选择和证书检查器形式化或至少可重复审计。"],"public_reasoning_summary_zh":"该问题的优势是结构清楚、可计算性强，并且题面已说明 r=2 有成功先例；这使 GPT-5.5 很适合搭建实验和验证基础设施，也可能发现有用的中间猜想。主要风险是问题要求对所有充分大的整数给出全称证明，且加数数量很少，属于稀疏加性数论的高难区域。因此我判断它不是高概率可直接解决的问题，但属于可以被模型工具链实质推进的低到中等候选。","not_a_solution_disclaimer_zh":"以上是 AI 可推进性评估，不是该 Erdős 问题的证明，也不声称已经证明或否定该命题。"}