{"problem_number":"1184","review_model":"GPT-5.5","review_type":"one_problem_model_review","verdict_zh":"低到中等候选。GPT-5.5 级别模型较可能把该问题重写为短区间内 k-光滑数的局部 Dickman 渐近，给出可检验的条件性定理、特殊区间尝试和大规模反例搜索；但直接完成无条件全范围证明的概率偏低。","level":"low_to_medium_candidate","score":38,"confidence":"medium","likely_route_zh":"把 f(n,k)=k-(区间 (n,n+k] 中 P(m)≤k 的整数个数) 作为核心对象，目标等价于证明长度为 k、位置 n=k^{α+o(1)} 的任意短区间中 k-光滑数个数为 ρ(α)k+o(k)。可行路线是：先用 Dickman/Buchstab 递推建立启发式和条件性归约；在 1<α<2 时把 P(n+i)>k 的数写成 p·m 并转化为变动短区间中的素数计数；对一般 α 用分层因子分解和光滑数短区间估计；同时用分段筛、快速最大素因子计算和针对性 n 选择搜索可能偏差。","supporting_reasons_zh":["问题结构清晰：目标只涉及最大素因子、短区间计数和 Dickman 函数，适合模型配合符号推导、数值实验和文献检索形成明确研究路线。","等价表述很直接：需要估计 Ψ(n+k,k)-Ψ(n,k)，其中 Ψ 表示 k-光滑数计数；这给了计算验证和条件性证明的自然入口。","给定备注已有 Erdős 与 Ramachandra-Shorey-Tijdeman 的非平凡界，说明该问题有可承接的传统解析数论框架，而不是完全无结构猜想。","对固定 α 的有限范围实验较容易实现：可用分段筛求 P(m)，比较 f(n,k)/k 与 1-ρ(α)，并系统测试 n 的不同同余结构和边界情形。","模型可较可靠地产出辅助成果：精确化 o(1) 的量词、构造条件性命题、检查特殊 α 区间、验证已有证明草图、搜索反例或异常族。"],"main_obstacles_zh":["核心难点是任意短区间的光滑数局部分布；区间长度只有 k，而数的大小约为 k^α，这正处在需要强均匀性的尺度。","n 不是平均意义下随机选取，而是允许任意满足 n=k^{α+o(1)} 的序列；排除局部算术偏差比平均型结果困难得多。","α≥2 时数可以含有多个大于 k 或接近 k 的因子，简单的 p·m 分解不再覆盖全部结构，Buchstab 分层会产生复杂相关项。","即使 1<α<2，精确主项也会涉及变动长度短区间中的素数分布和对 m 的求和，靠现成初等估计很难直接给出所需 uniform o(k)。","计算实验只能发现反例线索或支持启发式，不能替代无限族渐近证明；形式化证明也需要先有人类级解析论证。"],"validation_needed_zh":["检索并核对当前关于 friable/smooth numbers in short intervals 的最强定理，确认是否已覆盖 h=k、x≈k^α 的均匀任意区间情形。","为固定 α 设计可复现计算：取多组 k、n≈k^α，分段计算最大素因子，报告 f(n,k)/k 与 1-ρ(α) 的误差和收敛趋势。","专项搜索可能的反例族：n 接近幂、阶乘/最小公倍数的可行截断、强同余约束、smooth-rich 或 smooth-poor 的局部构造。","把目标拆成可证明的条件性命题，例如假设短区间光滑数局部 Dickman 定理、短区间素数均匀性或 Elliott-Halberstam 型输入时推出原结论。","检查 α 接近 1、2 以及整数 α 附近的边界行为，确保 Dickman 主项、误差项和 n=k^{α+o(1)} 的量词一致。"],"public_reasoning_summary_zh":"该问题本质上问：在位置 n≈k^α、长度 k 的每个短区间里，k-光滑数是否具有 Dickman 预测密度 ρ(α)。这正是解析数论中非常强的局部分布问题。GPT-5.5 配合工具可以把问题规约、实验验证、建立条件性结果并可能推进某些 α 范围，但无条件证明全命题需要突破短区间光滑数均匀分布的核心障碍，因此不应评为高可解候选。","not_a_solution_disclaimer_zh":"以上是对 AI 辅助可攻性的审查，不是该 Erdős 问题的证明或反例。"}