{"problem_number":"131","review_model":"GPT-5.5","review_type":"one_problem_model_review","verdict_zh":"部分可验证、可推进，但整体正确增长阶仍不太可能由一次 GPT-5.5 级工具辅助流程直接解决。给定备注已经说明原始的 N^{1/2-o(1)} 下界猜想为否；模型较适合复核这一否定路线、整理已知上下界、做小规模反例/构造搜索和形式化局部引理。","level":"low_to_medium_candidate","score":45,"confidence":"medium","likely_route_zh":"最现实路线是把问题拆成两层：先验证给定备注中的蕴含链，即非整除集合属于非平均集合，从而可调用非平均集合的上界得到 F(N) <= N^{1/4+o(1)}，这已足以否定 F(N)>N^{1/2-o(1)}；再用计算搜索、SAT/ILP 编码和结构化构造搜索尝试缩小 N^{1/5} 与 N^{1/4+o(1)} 之间的差距。形式化证明可优先覆盖定义转换、单调性、有限搜索证书和已知构造的正确性。","supporting_reasons_zh":["问题定义短且约束可计算化：对给定 N 和集合 A，可以直接检查每个 a 是否整除其他不同元素子和，因此适合反例搜索、最大化搜索、SAT/ILP 或动态规划式验证。","备注中已经给出关键结论：每个这样的集合都是非平均集合，因此 Pham-Zakharov 型上界推出 F(N) <= N^{1/4+o(1)}，原始 N^{1/2-o(1)} 问题可被工具辅助核验为否。","已有上下界和相关构造路线明确，包括显式上界、N^{1/5} 构造、Straus 的次指数下界，这给模型提供了可审计的起点。","模型可能在有限 N 数据、OEIS 序列解释、构造模板搜索、证明草稿检查和形式化局部性质方面产生实质性辅助价值。"],"main_obstacles_zh":["核心仍是渐近极值组合数论问题，当前上下界间存在显著指数差距，单靠模式搜索很难推出正确增长阶。","非整除条件涉及所有不同元素子和的整除关系，局部约束与全局子集和结构强耦合，直接优化很快出现组合爆炸。","若要突破 N^{1/5} 或 N^{1/4+o(1)}，可能需要新的加性组合或数论结构思想，而不是仅仅形式化已有证明。","备注只给出结论摘要而非完整证明，若不进行外部文献检索，无法确认 Pham-Zakharov 上界、非平均集合定义及引用细节的全部技术条件。"],"validation_needed_zh":["核验“每个非整除集合都是非平均集合”的定义级证明，确保没有遗漏 distinct elements、是否允许空和、平均元素是否属于集合等边界条件。","查验 Pham-Zakharov 结果适用的非平均集合定义是否与本问题所需版本完全一致。","对小 N 建立独立穷举或 SAT/ILP 证书，和 OEIS A068063 的数值进行一致性检查。","若提出新下界构造，需要对所有元素的所有其他元素子和做可机检验证，并给出渐近参数证明。","若提出新上界，需要把从非整除到更强/更广类别的归约和引用定理的量词、误差项、常数依赖全部形式化或逐条审校。"],"public_reasoning_summary_zh":"这个问题对 GPT-5.5 级模型最适合作为“验证与推进候选”，而不是高概率完整解决候选。给定材料已经包含一个强结论：原始询问的 N^{1/2-o(1)} 下界被 N^{1/4+o(1)} 上界否定，因此模型可以较可靠地复核这一点并生成可检查证明框架。真正困难的是确定 F(N) 的正确增长阶；这需要在已知下界 N^{1/5} 或次指数构造与上界 N^{1/4+o(1)} 之间取得新的渐近突破，难度明显高于常规计算搜索。","not_a_solution_disclaimer_zh":"以上不是问题 131 的解答，也没有声称给出新的上下界；它只是基于所给 problem JSON 对 GPT-5.5 级工具辅助系统可完成、可推进和需验证部分的可审计评估。"}