{"problem_number":"119","review_model":"GPT-5.5-level model with computation/formalization/literature tools","review_type":"one_problem_model_review","verdict_zh":"这是一个低到中等候选问题：模型很可能能整理并验证已知的前两部分、复现若干计算实验、探索第三问的可行路线和潜在反例结构；但要独立解决第三个仍公开的问题，成功概率不高。","level":"low_to_medium_candidate","score":42,"confidence":"medium","likely_route_zh":"可行路线应聚焦第三问：把问题转化为单位圆上对数势或三角多项式的下界问题，结合已知的 Wagner/Beck 型最大值增长结果，尝试证明大峰值会在足够多的相邻 k 上产生可累积贡献；同时用计算搜索构造低 M_k 序列，检验是否可能存在长期接近线性和的反例。形式化证明工具可用于验证辅助引理，例如 Jensen 公式、L^p 到 L^∞ 估计、乘上一个线性因子后 M_k 的局部变化界等。","supporting_reasons_zh":["题面已说明前两问已有非平凡正向结果，因此该问题不是完全无入口；模型可复现并组织这些路线，作为第三问的基线。","对象定义清晰且已形式化，适合把局部不等式、范数估计和有限计算搜索接入证明检查器或数值验证流程。","第三问是关于 \\sum_{k\\le n}M_k 的平均增长，可能比逐点最大值结果更适合通过能量分布、峰值传播或分块论证推进。","计算工具可以搜索极小化 M_k 的根序列，帮助发现 Linden 型构造的行为是否接近第三问障碍。"],"main_obstacles_zh":["第三问仍标注为似乎公开，且已有构造能让 M_n 显著低于线性增长，说明简单的系数、Mahler 测度或最大模原理估计远远不够。","Beck 的 \\max_{n\\le N}M_n>N^c 只保证稀疏峰值，不能直接推出部分和超过 n^{1+c}；核心缺口是把稀疏大值转化为足够密集的贡献。","根序列完全任意且可自适应选择，反例搜索空间很大，数值优化容易产生误导性有限样本。","即使找到强实验规律，也需要非渐近常数、无限序列紧致性或递推稳定性论证，形式化成本较高。"],"validation_needed_zh":["核对 formalized 版本是否覆盖三问以及已知定理引用，而不是只形式化定义或较弱命题。","复现 Beck 型下界与 Linden 型上界构造的关键引理，确认第三问不能由现有结果直接推出。","进行针对第三问的数值优化：最小化 \\sum_{k\\le n}M_k 或平均 M_k，并检查最优序列的结构是否稳定。","若提出证明路线，需要用独立证明检查或严密手稿验证峰值传播、分块累积和极限过渡步骤。"],"public_reasoning_summary_zh":"该问题的已解决部分给了模型可利用的理论脚手架，但真正剩余的是第三个平均增长问题。它看起来不像纯计算即可攻破的问题，因为必须处理任意无限单位圆根序列并获得渐近下界。GPT-5.5 级别系统更现实的贡献是复现文献、发现等价命题、测试极端构造、验证局部引理，并可能给出有价值的部分推进；完整解决第三问属于低概率但非零概率事件。","not_a_solution_disclaimer_zh":"以上是对 AI 辅助可解性和推进潜力的审查，不是该 Erdős 问题的证明或反例。"}