{"problem_number":"774","review_model":"GPT-5.5","review_type":"one_problem_model_review","verdict_zh":"中等偏低候选。GPT-5.5 级别模型配合工具更可能在该问题上做出结构化推进、验证有限模型或构造候选反例框架，而不太可能直接给出完整定理证明或最终反例。","level":"low_to_medium_candidate","score":42,"confidence":"medium","likely_route_zh":"较可行的路线是把有限子集上的“dissociated”视为无非平凡 ±1 线性关系的独立性条件，将问题转化为某类有限关系超图的有界着色问题：比例 dissociated 对应每个有限诱导结构有线性大小独立集，而有限并 dissociated 对应全局有限染色。AI 可尝试搜索满足局部线性独立数但色数无界的有限结构族，并检验它们能否嵌入为整数集合的子和关系；另一路线是从备注中给出的 harmonic-analysis Sidon 等价刻画出发，尝试把已知的充分条件、随机构造或有限维模型形式化为可验证引理。","supporting_reasons_zh":["定义离散、有限化程度高：任意有限 B 上的 dissociated 子集和有限并分解都可转写为组合/约束满足问题，适合 SAT/SMT、ILP、Lean 形式化检查和反例搜索。","题目已标记 formalized=yes，说明至少部分定义和命题可进入形式化证明环境，有利于机器验证中间引理和有限归约。","备注给出了等价的 harmonic-analysis Sidon 表述，这提供了另一套可操作的判据，AI 可用文献检索工具梳理等价条件、稳定性命题和可能的反例构造模板。","该问题的目标可能是负例或条件性结构定理；对 AI 来说，搜索有限高色数关系结构、再寻找整数实现，比纯粹闭门证明更有现实推进空间。"],"main_obstacles_zh":["核心难点在于从“每个有限子集有线性大小 dissociated 子集”推出或否定“全局有限个 dissociated 集覆盖”，这是局部稀疏性与全局有限着色之间的强组合差距。","若走反例路线，仅找到有限关系超图还不够，必须证明这些关系能由自然数集合的子和等式真实实现，并且无限拼接后仍保持比例 dissociated。","若走正向证明，需要把 harmonic-analysis Sidon 性质强化为有限个 dissociated 块的分解，这看起来明显强于备注中已知的等价性质。","备注中已有作者判断其充分性“不太可能”，说明负例方向或许更可信，但这不是证明；AI 容易产生看似合理但嵌入或极限步骤失败的构造。"],"validation_needed_zh":["建立有限模型：精确定义关系超图、独立集、有限染色与原问题中 dissociated/有限并 dissociated 的双向对应范围。","用计算搜索产生小规模候选结构，并独立验证其线性独立数下界与色数增长。","证明候选有限结构可由整数集合的子和关系实现，且不会引入破坏性质的额外关系。","若构造无限集合，需要验证所有有限子集仍有统一比例的 dissociated 子集，并证明任意有限染色都会在某一块中失败。","所有关键归约和有限检查应形式化或至少由独立脚本复验，避免把启发式搜索结果误当成数学证明。"],"public_reasoning_summary_zh":"这个问题对 AI 的可攻性主要来自其有限组合化特征：dissociated 是有限子和唯一性条件，比例版本和有限并版本都能转写为独立集与着色性质。因此，GPT-5.5 加工具有机会系统搜索、验证和组织候选反例或局部定理。但问题连接 Sidon 集与调和分析，且需要从有限/局部性质控制无限/全局分解，最终证明门槛高。综合判断是：可显著推进的概率不低，直接解决的概率仍偏低。","not_a_solution_disclaimer_zh":"以上只是对 GPT-5.5 级别模型辅助研究可行性的审查，不是该 Erdős 问题的解答，也不声称给出了证明或反例。"}