{"problem_number":"365","review_model":"GPT-5.5","review_type":"one_problem_model_review","verdict_zh":"适合由 GPT-5.5 级别模型做“验证与显著推进”，但不宜预期直接完整解决剩余开放部分。给定 JSON 中第一问已由反例和无限族否定；模型最有希望完成的是严格核验这些反例、形式化 powerful 数定义下的验证、整理 Pell 型无限族，并对第二问建立条件性结果、计算证据或较弱上界。","level":"low_to_medium_candidate","score":42,"confidence":"medium","likely_route_zh":"可行路线是先把 powerful 数写成 a^2 b^3 形式，其中 b 可取平方因子受控的无平方因子部分；于是连续 powerful 数转化为 a^2 b^3 + 1 = c^2 d^3 的参数化丢番图问题。模型可用计算搜索枚举 b,d 或直接枚举 powerful 数并查找相邻对，验证 OEIS 型数据和 Golomb 反例 12167、12168；再对 Walker 方程 7^3 x^2 = 3^3 y^2 + 1 给出 Pell 型递推、证明其产生无限多个反例。第二问可尝试按固定 b,d 化为 Thue/Pell/超椭圆曲线族，结合已有算法或形式化证明工具验证有限范围，并探索是否能证明某些参数区域只贡献 polylog 数量。","supporting_reasons_zh":["第一问在题目备注中已经有明确反例和无限反例族，因此 GPT-5.5 配合计算与形式化工具很可能能完整验证这一部分，而不是从零解决未知问题。","powerful 数有标准结构分解，适合转写为参数化丢番图方程，便于计算搜索、局部筛、Pell 递推验证和有限范围证书生成。","第二问是计数上界问题，模型可以显著推进为条件性证明、特殊参数族证明、搜索反例、生成数据和提炼可能的归约障碍。","该问题的对象离散且定义清楚，形式化验证单个反例、无限 Pell 家族、枚举程序正确性都比较适合 LLM 加工具链完成。"],"main_obstacles_zh":["第二问要求全局 polylog 上界，涉及所有 powerful 相邻对；这比验证 Pell 族或固定参数方程困难得多。","变量分解 n=a^2 b^3 后，b,d 的范围仍随 x 增长，固定曲线或固定 Pell 方程上的控制不足以自动给出全局 polylog 计数。","可能需要深层丢番图几何、abc 型思想、Thue 方程族的一致界或有效高度界；这些通常不是当前模型能可靠原创完成的部分。","题目备注已经否定第一问，所以真正开放价值集中在第二问；模型若没有外部文献和严格证明验证，容易把经验性搜索误认为证明。"],"validation_needed_zh":["形式化定义 powerful 数，并机械验证 12167=23^3 与 12168=2^3 3^2 13^2 均 powerful，且二者连续且都不是平方。","证明 Walker 方程的解确实给出无限多个连续 powerful 数，并检查所得 n 与 n+1 中是否均非平方或是否确实构成对第一问的反例。","对任何计算枚举，需给出不漏枚举的生成方式，例如基于 a^2 b^3 且 b 无平方因子，或基于完整质因数分解的交叉校验。","若声称第二问有进展，需明确是无条件、条件性还是有限范围验证，并提供可复现代码、边界证明和必要的定理依赖。"],"public_reasoning_summary_zh":"这个问题对 AI 的可解性应拆开看：反例验证和 Pell 型无限族验证是高可行任务；剩余的 polylog 计数上界是核心困难，可能需要统一控制一大族丢番图方程，当前模型更可能给出可靠的局部结果、计算证据和证明路线，而非完整无条件解答。因此评为 low_to_medium_candidate。","not_a_solution_disclaimer_zh":"以上不是该 Erdős 问题的解答，只是基于给定 problem JSON 对 GPT-5.5 级别模型在工具辅助下可能完成、推进或验证程度的审查。"}