{"problem_number":"176","review_model":"GPT-5.5-with-tools","review_type":"one_problem_model_review","verdict_zh":"这是一个可被 AI 显著推进但不太可能被一次性彻底解决的候选问题。核心难点不是形式化计算量，而是需要新的组合构造或新的全局不平衡强迫机制；不过问题表述清晰、参数化强、可计算实验和概率方法都很适合模型辅助探索。","level":"medium_candidate","score":58,"confidence":"medium","likely_route_zh":"较现实的路线是把它拆成三个层级：先对固定小偏差目标如 N(k,2) 做精确反例搜索和 SAT/ILP 建模，寻找能让所有 k-AP 平衡或低偏差的 ±1 序列结构；再用局部引理、熵压缩、容器或半随机方法系统改进下界构造；最后尝试从 AP 超图的谱、Fourier/Gowers 范数、矩阵秩或 discrepancy lower-bound 技术中提炼上界机制。GPT-5.5 级模型更可能产出可验证的边界改进、等价重述、实验猜想和特定参数族证明，而不是直接证明所有 c>0 的指数上界。","supporting_reasons_zh":["问题定义短而精确，适合自动形式化成 SAT/ILP/CP-SAT、Lean 辅助定义、以及可重复的反例搜索流程。","目标是“good upper bounds”且包含 N(k,2)、N(k,sqrt(k))、N(k,ck) 等多个可分解子问题，AI 可以先推进较弱或特殊情形。","现有备注已经给出概率下界和 k=1 偏差情形的结构性结果，说明可从已知 discrepancy、局部引理和算术级数超图技术出发，而不是完全无入口。","计算实验很有价值：小 k 的极值染色、自动发现周期构造、傅里叶特征和 AP 约束矩阵的线性代数性质，都可能帮助形成新引理。","形式化验证适用于局部成果：一旦得到有限参数证书、递推构造或一个简洁组合引理，可以用 proof assistant 或证书检查器减少幻觉风险。"],"main_obstacles_zh":["全局指数上界 N(k,2)<=C^k 看起来要求强迫任意 ±1 序列在某个长 AP 上出现非平衡，这接近深层 discrepancy/Ramsey 型现象，单靠模式匹配很难完成。","AP 族高度相关，普通随机、union bound 或标准 discrepancy 工具可能只能给出非尖锐或方向错误的界。","对小偏差 ell=2 的情形，奇偶性、完全平衡 AP、周期染色和 2-adic 结构可能制造大量伪规律，AI 容易从有限实验过度归纳。","若需要证明对所有 k 或所有 c>0 成立，必须控制常数 C 对 c 的依赖和所有大 k 的一致性，这通常是技术核心。","开放状态和“no decent bound”提示该问题可能长期缺少有效上界框架，因此完整解决概率有限。"],"validation_needed_zh":["建立独立的计算验证器：给定 k,N 和染色，枚举所有 k-AP 并检查最大偏差；对不可满足性用 SAT/ILP 证书或 DRAT/CP-SAT 日志验证。","对任何声称的上界证明，逐步核查量词顺序：C 是否只依赖 c，N 是否对所有足够大或所有 k 成立，ell 的取整如何处理。","检验小 k 数据是否受奇偶性影响，分别处理 k 偶、k 奇、k 的 2-adic 分解以及 ell=2 时的阈值定义。","把实验发现的构造与已知备注中的 Spencer 结果和局部引理下界兼容性相互校验，避免提出已被下界排除的过强猜想。","若使用文献检索，需要限定到本题相关的 AP discrepancy、hypergraph discrepancy、van der Waerden 型界和 Spencer/Erdos-Graham 语境，并人工复核定理条件。"],"public_reasoning_summary_zh":"我将该题评为 medium_candidate，因为它具备 AI 工具链可发挥作用的结构：问题可精确编码、参数可实验、有限证书可验证，并且已有概率下界与特殊情形给出切入点。但主要问题是一般指数上界很可能需要新的组合不平衡强迫思想，而不是把现成定理直接套上去。GPT-5.5 级系统较可能完成的是系统化实验、发现候选结构、证明特殊族或改进某些界；完整回答所有子问题的概率中等偏低。","not_a_solution_disclaimer_zh":"以上是对 AI 可推进性的审查，不是该 Erdős 问题的解答，也未声称证明任何新的上界或下界。"}