{"problem_number":"676","review_model":"GPT-5.5","review_type":"one_problem_model_review","verdict_zh":"低到中等候选：GPT-5.5 配合计算与筛法工具很可能能显著推进实验验证、生成反例搜索框架、改进例外集合上界或形式化等价条件，但直接解决“是否所有充分大整数均可表示”或证明无限多例外的概率偏低。","level":"low_to_medium_candidate","score":43,"confidence":"medium","likely_route_zh":"较现实的路线是先把条件重写为：存在素数 p<=sqrt(n) 使 n mod p^2 < p。然后用高性能筛法对大区间标记可表示数，搜索例外与极端 c_n；并用概率模型、Brun-Selberg 型筛法和覆盖同余类分析估计例外密度。若发现稳定结构，可尝试构造无限例外的同余覆盖或证明更强的稀疏性上界。形式化证明工具更适合验证有限计算、等价变形和局部引理，而不是直接给出核心解析数论突破。","supporting_reasons_zh":["问题表述短，核心判定条件可算法化：对每个 n 检查是否有素数 p 使 n 落在模 p^2 的前 p 个剩余类中。","给出的备注已经提示“几乎所有整数”已知可表示，并有筛法例外上界；这给模型一个明确的技术入口，而不是完全无结构的开放问题。","计算搜索非常自然：可用分段筛、位集和模 p^2 区间标记来扩大已验证范围，寻找例外、估计例外数量并测试 c_n 增长。","模型可辅助提出等价命题、概率启发、候选反例模式、有限验证证书格式，以及对一般化版本 A 与 f 的条件进行系统化探索。","若目标降低为“显著推进或验证”，AI 工具组合有较高价值：可以复现实验、生成 OEIS 数据、找出可能的无限族线索或排除低范围内的异常模式。"],"main_obstacles_zh":["原问题要求最终的全局定理或反例无限族；这通常需要新的解析数论或组合筛法思想，不能仅靠扩大有限搜索解决。","每个素数 p 只覆盖模 p^2 中约 1/p 的剩余类，覆盖事件高度相关；从“几乎所有”提升到“所有充分大”是典型困难跃迁。","备注中 Erdős 认为结论“不太可能”，并提到即使去掉素数条件也可能有无限多例外；这暗示正向证明路线可能并非主流。","反向证明也不容易：要证明无限多 n 同时避开所有相关素数 p 的短剩余区间，需要强构造或深筛法，而不是普通随机模型。","形式化系统可检查局部证明和计算证书，但当前不会自动发现所需的核心筛法突破。"],"validation_needed_zh":["实现独立的分段筛验证器，确认 n 可表示当且仅当存在素数 p<=sqrt(n) 满足 n mod p^2 < p。","对大区间统计例外数量、最大连续无例外区间、最小 c_n，并用至少两个独立实现交叉校验。","若提出候选无限例外构造，需要验证其同余条件能同时避开所有 p<=sqrt(n)，而非只避开有限素数集合。","若提出正向证明，需要严格补齐从几乎所有到无例外的步骤，特别是处理例外集合可能的结构化聚集。","任何计算辅助结论都应输出可复查证书：素数表、区间范围、标记规则、哈希摘要和边界条件。"],"public_reasoning_summary_zh":"这个问题对 AI 来说不是一个单纯的暴力搜索题，但它有很好的工具切入点。表示条件可转化为模 p^2 的短区间覆盖问题，因此 GPT-5.5 可组织计算筛、概率模型和局部证明验证来大幅扩展实验事实，并可能发现新的反例模式或改进例外估计。不过，从有限验证或密度为 1 的结果跨到最终判定“所有充分大”或“无限多例外”，需要解决全局筛法与相关性障碍。因此它适合作为低到中等强度的 AI 可推进候选，而不是高概率可完全解决的候选。","not_a_solution_disclaimer_zh":"以上是对 GPT-5.5 级别模型可推进性的审查，不是该 Erdős 问题的解答，也未声称证明存在或不存在充分大整数的最终表示性。"}