{"problem_number":"98","review_model":"GPT-5.5","review_type":"one_problem_model_review","verdict_zh":"低到中等候选：GPT-5.5 级别模型不太可能直接完整解决该开放问题，但有现实机会在构造搜索、局部结构归纳、已有证明路线形式化、以及候选反例/上界验证方面产生有价值推进。","level":"low_to_medium_candidate","score":42,"confidence":"medium","likely_route_zh":"最可行路线不是直接证明 h(n)/n 趋于无穷，而是把问题拆成可验证的中间目标：形式化定义极小距离数配置；用 SAT/SMT、代数约束或数值优化搜索小 n 的低距离配置；分析“无三点共线、无四点共圆”如何限制重复距离图；尝试证明某些额外假设下的线性以上下界；并复核已有上界构造是否可被扰动且保持距离种类少。若能找到稳定的结构定理或排除一大类近线性构造，才可能进一步接近主命题。","supporting_reasons_zh":["题目陈述短、约束清晰，适合被转写为组合几何、图论和代数约束问题，便于计算搜索与形式化验证参与。","问题目标是渐近下界 h(n)/n -> infinity，不要求精确确定 h(n)，因此存在通过中间增长下界取得显著推进的空间。","备注中已有非平凡上界 n exp(c sqrt(log n))，说明存在可分析的接近线性构造族；AI 可围绕这些构造做扰动、验证和结构抽象。","无三点共线、无四点共圆是强一般位置条件，可能让重复距离图受到额外限制，适合用自动化枚举和局部禁图分析寻找新引理。"],"main_obstacles_zh":["核心难点是全局渐近下界，而不是有限规模验证；小 n 搜索很难直接推出 h(n)/n -> infinity。","重复距离结构可以非常复杂，仅靠一般位置条件未必足以给出容易证明的超线性下界。","若已有上界构造接近线性且可满足这些一般位置条件，则任何下界证明都必须非常精细，普通启发式推理风险高。","形式化欧氏几何中的圆、距离相等、共线性和一般位置扰动会带来较重的代数复杂度。"],"validation_needed_zh":["系统检索并核对该问题的最新进展，确认是否仍开放以及 h(n) 的最好已知下界。","对小 n 进行精确或高置信度计算搜索，记录最少 distinct distances 的候选配置，并验证一般位置条件。","把候选证明中的关键几何引理转写为代数或图论命题，用 Lean/Isabelle 或 CAS 辅助检查。","复现备注中的上界构造，确认其是否满足或可调整为满足无三点共线、无四点共圆，同时保持距离种类上界。"],"public_reasoning_summary_zh":"该问题适合作为 AI 辅助研究对象，因为它有明确的有限配置定义、可计算的搜索空间切片、可形式化的一般位置条件，以及已有上界可供逆向分析。但主命题是开放的渐近组合几何下界，通常需要新的结构性思想；GPT-5.5 更可能先产生局部定理、排除若干构造族、复现和验证已知界，而不是一次性给出完整证明。","not_a_solution_disclaimer_zh":"以上是对 AI 辅助可推进性的审查，不是该 Erdős 问题的解答，也不声称证明或反驳 h(n)/n -> infinity。"}