{"problem_number":"786","review_model":"GPT-5.5","review_type":"one_problem_model_review","verdict_zh":"中等候选。若按允许重复的乘积理解，给定备注已经指出负答案可由已知加性函数分布结果推出，GPT-5.5 级别模型很可能能完成文献定位、证明重构与形式化核验。若按“不允许重复”的开放版本理解，则它不太可能独立彻底解决，但有现实机会显著推进：澄清等价表述、搜索有限反例或高密度构造、验证 Ruzsa 相关断言、把问题转化为素因子指数向量中的不同基数子集和碰撞问题。","level":"medium_candidate","score":62,"confidence":"medium","likely_route_zh":"先固定解释：允许重复版本可转化为存在加性函数 f 且 A={n:f(n)=1} 的密度上界问题，并复核 ERS73 与 Granville-Soundararajan 型结论。对真正开放的 distinct-elements 版本，路线应是把每个 n 表示为素数指数向量，要求 A 中不同大小的无重复子集不能有相同向量和；随后结合平滑数/大素因子分解、随机筛选、有限 N 的整数规划或 SAT/SMT 搜索，以及已知加性函数分布工具，寻找密度上界或改进构造。","supporting_reasons_zh":["题面备注本身给出了允许重复版本的关键证明框架：由乘积长度良定性定义加性函数 f，并用 Erdős-Ruzsa-Sárközy 定理推出密度上界，因此模型可核验和整理这一路线。","问题已有形式化标记，说明至少部分定义或结论适合被定理证明器表达；这提高了模型配合形式化工具发现定义歧义、检查小引理和避免伪证明的可行性。","有限版本天然适合计算实验：可把乘积等式转化为素因子指数向量的线性关系，并用 MILP/SAT/搜索来测试高密度候选集合的极限行为。","备注给出了若干具体构造和上界常数，模型可围绕这些锚点做可审计的复现、改进尝试和边界案例分析，而不是从零探索。","distinct 版本虽然开放，但其结构离散且可计算，模型可生成大量候选筛选策略和反例搜索脚本，较可能产生有用的经验规律或局部定理。"],"main_obstacles_zh":["核心困难在于题目解释歧义：允许重复版本已基本由备注中的已知结果解决，而 distinct-elements 版本仍可能是真正开放问题。","若目标是证明密度不能趋近 1，distinct 版本需要排除非常复杂的高密度乘法 Sidon/弱独立结构，现有加性函数方法不能直接套用。","计算实验受限于素因子向量维度和子集碰撞规模，有限 N 的最优解未必能可靠外推到渐近密度。","文献线索中存在未发表或可能误引的 Ruzsa 结果；模型需要严格区分可验证定理、评论推断和历史表述。","构造下界和上界常数之间可能存在很大空隙，单靠启发式搜索容易产生看似强但不可推广的模式。"],"validation_needed_zh":["明确审查对象采用允许重复还是 distinct-elements 解释，并把两种解释下的命题分别形式化。","核查 ERS73、Granville-Soundararajan 及题面备注所述推论是否确实给出相应密度上界，尤其是常数和适用条件。","对有限版本建立独立的 SAT/MILP 或精确搜索验证器，复现小 N 最优值并检查候选构造是否满足无不同长度乘积等式。","若提出新上界，需要把计算观察转化为可审计引理，并用形式化证明或至少机器可检查证明确认关键组合步骤。","若提出新构造，需要给出渐近密度估计和严格证明，而不仅是有限样本表现。"],"public_reasoning_summary_zh":"这个问题的 AI 可推进性主要来自其清晰的代数编码：乘积相等等价于素因子指数向量和相等，长度条件等价于不同基数表示之间不发生碰撞。允许重复时，备注已经给出通往已知负答案的标准路线，所以模型更像是在完成验证和整理。真正有研究价值的是不允许重复的解释；这里模型难以保证完整解决，但能有效承担形式化澄清、文献核查、有限搜索、构造测试和局部引理发现，因此评为中等候选而非高候选。","not_a_solution_disclaimer_zh":"以上是对 GPT-5.5 级别模型辅助研究可行性的评估，不是该 Erdős 问题的解答，也不声称给出了新的上界、下界或完整证明。"}