{"problem_number":"860","review_model":"GPT-5.5-level model with tools","review_type":"one_problem_model_review","verdict_zh":"低到中等候选：模型较可能在形式化建模、计算实验、文献线索整理、上下界验证和局部改进尝试上产生有用进展，但要给出被数论界接受的整体渐近估计，成功概率偏低。","level":"low_to_medium_candidate","score":36,"confidence":"medium","likely_route_zh":"把问题重写为区间内对前 pi(n) 个素数的不同倍数选择问题，并用 Hall 条件、筛法、覆盖系统、匹配/超图匹配和随机模型分析上下界。计算侧可枚举有限 n 的精确或近似 h(n)，测试 OEIS 序列与极值构造；理论侧可尝试改进 Erdős-Pomerance 型上界或 Ruzsa 型下界的量化版本。","supporting_reasons_zh":["问题陈述短，核心对象清晰，适合被形式化为有限区间中的匹配存在性问题，工具化搜索和定理证明辅助有入口。","已知结果给出非平凡上下界：上界 h(n) << n^{3/2}/(log n)^{1/2}，下界从线性常数级增强到 h(n)/n -> infinity，说明仍有较大改进空间。","可计算实验价值较高：对前若干素数和滑动区间做二分搜索、最大匹配或 SAT/ILP 编码，可能发现极端构造、猜测正确量级或否定朴素猜想。","模型可结合文献检索梳理 Erdős-Pomerance、Erdős-Selfridge、Ruzsa 路线，寻找是否有现代筛法、稀疏匹配或 covering congruence 技术可迁移。"],"main_obstacles_zh":["核心难点不是有限验证，而是全局渐近估计；需要同时控制所有起点 m 的最坏区间，并保证不同素数对应不同整数。","上下界之间差距很大，已知 Ruzsa 结果表明线性估计不足，但现有上界仍远高于线性，正确量级可能依赖精细的素数倍数覆盖结构。","Hall 条件会转化为许多素数子集的并集覆盖下界，直接枚举或直接 union bound 很可能过粗。","若要取得实质理论突破，可能需要新的筛法构造或反构造，而不是单纯计算或形式化现有证明。"],"validation_needed_zh":["重新核对 problem JSON 中引用结果的原文证明，确认 h(n) 的定义、开区间约定和 n 与 pi(n) 的参数关系没有歧义。","建立可复现实验程序，计算小到中等 n 的 h(n) 或上下界，并与 OEIS A048670、A058989 所指序列一致性检查。","若提出新上界，需要逐项验证 Hall 条件或等价匹配条件在所有 m 上成立，并检查常数、log 因子和边界 n。","若提出新下界，需要给出显式或概率构造的一族起点 m，使任意长度较短区间无法容纳所有前 pi(n) 个素数的不同倍数。","重要理论声明应经过独立证明审阅，最好用 Lean/Isabelle 等形式化关键组合引理或用程序穷举验证有限例外范围。"],"public_reasoning_summary_zh":"这个问题有明确的组合数论结构，AI 工具链可以把它转化为匹配、筛法和计算搜索问题，因此不是完全不可接近。可是已知结果显示真实量级仍隐藏在较大的上下界间隙中，且最坏区间与不同代表元约束会放大证明难度。综合判断，GPT-5.5 级别模型较可能产出可靠实验、等价刻画、局部常数或对数因子改进的候选路线；直接完成完整估计的概率较低。","not_a_solution_disclaimer_zh":"以上只是 AI 可推进性评估，不是该 Erdős 问题的解答，也未声称给出新的有效上下界。"}