{"problem_number":"346","review_model":"GPT-5.5","review_type":"one_problem_model_review","verdict_zh":"中等候选。该题结构具体、已形式化，并且核心似乎可转化为尾部子集和覆盖区间、有限删除鲁棒性、无限删除破坏性的定量不等式；GPT-5.5 配合计算搜索和形式化证明有机会显著推进。但完整证明需要处理任意不规则指数增长序列和对所有无限删除的全称量词，独立解决不应高估。","level":"medium_candidate","score":60,"confidence":"medium","likely_route_zh":"把“任意有限删除仍完全”转写为每个尾部及单点删除后的最终覆盖条件；把“任意无限删除都不完全”转写为无法无限次跳过若干项而仍保持最终覆盖。随后围绕相邻比值和尾和比例建立临界不等式：若局部比值长期或频繁高于黄金比，单点或有限删除后的覆盖应产生缺口；若局部比值长期或频繁低于黄金比，则尝试构造一个稀疏无限删除仍保留覆盖，从而矛盾。计算工具可搜索有限前缀模型和删除策略，形式化工具可验证覆盖引理与极限推出步骤。","supporting_reasons_zh":["题目对象是正整数递增序列和不同元素子集和覆盖，适合用程序枚举有限前缀、检测覆盖缺口、搜索无限删除策略的有限近似。","已给出一个黄金比极限的示例，以及备注中关于比值大于黄金比时第二性质自动满足的提示，这为临界不等式提供了明确方向。","“有限删除仍完全”与“无限删除不完全”是强结构条件，可能比一般开放数论问题更适合被转写成可证明的覆盖准则。","问题已形式化，这降低了最终验证门槛；即使不能完成证明，也可把关键引理、反例搜索失败范围和等价表述机械化。"],"main_obstacles_zh":["最困难处不是固定比值模型，而是高度不规则的比值序列；局部偏离黄金比可能被后续项补偿，简单渐近估计可能不够。","“任意无限子集 B 删除后都不完全”包含很强的二阶全称量词，构造或排除所有可能的稀疏删除策略很难。","完整性只要求所有充分大整数可表示，而不是从 1 开始无缺口；因此常见的前缀覆盖准则需要带阈值和尾部版本，形式化细节容易出错。","备注说可构造很不规则的满足两性质序列，说明直觉型平滑性假设不可靠；必须严格使用额外条件 a_{n+1}/a_n >= 1+epsilon。"],"validation_needed_zh":["证明或形式化一个适用于“充分大整数”的尾部覆盖判据，并确认它在有限删除后的版本仍等价。","用计算搜索有限前缀模型，测试比值 limsup 高于黄金比或 liminf 低于黄金比时是否总能产生相应覆盖缺口或无限删除策略。","对关键临界不等式进行 Lean/Isabelle 等形式化验证，尤其是从覆盖性质推出关于尾和与相邻比值的定量约束。","若提出反例或候选构造，需要验证两条性质对所有有限删除和所有无限删除都成立，而不是只对抽样删除成立。"],"public_reasoning_summary_zh":"公开可审计的判断是：该题的黄金比很可能来自“删除一项后，前面可用项的最大尾和是否足以接上下一个大项”的临界条件；黄金比以上容易产生删除后的覆盖缺口，黄金比以下可能允许删去无限稀疏项仍保持覆盖。GPT-5.5 的优势在于把这些直觉系统化为覆盖引理、有限模型搜索和形式化验证；弱点在于处理任意不规则序列和所有无限删除策略。因此它是值得投入工具化攻击的中等候选，而非明显可自动解决的问题。","not_a_solution_disclaimer_zh":"这不是该 Erdős 问题的解答；以上只是基于给定 Problem JSON 对 GPT-5.5 级别模型可推进性的评估。"}