{"problem_number":"788","review_model":"GPT-5.5","review_type":"one_problem_model_review","verdict_zh":"中等候选：GPT-5.5 级别模型较可能显著推进验证、重构现有论证、做有限范围反例/构造搜索，并可能把问题进一步归约到随机 Cayley 图独立数或相关加性能量命题；但直接证明目标上界 f(n)≤n^{1/2+o(1)} 的概率不高，因为这等价地依赖备注中提到的随机 Cayley 图独立数 p^{-1+o(1)} 型强猜想，当前 JSON 已显示最强已知路线只到 n^{3/5+o(1)}。","level":"medium_candidate","score":58,"confidence":"medium","likely_route_zh":"把问题形式化为 f(n)=min_B(|B|+alpha(G_B))，其中顶点为 (n,2n) 内整数，边由 c_1+c_2∈B 定义；先复现 Choi、Hunter、Baltz-Schoen-Srivastav 以及 Alon-Pham 路线所暗示的上界机制，再用计算搜索小 n 的极值 B、结构化候选 B、随机 B 与 Cayley 图模型来寻找模式。最现实的 AI 贡献是给出现有 n^{3/5+o(1)} 推论的清晰形式化证明草案、验证常数/对数损失、构造下界族，并尝试把 sqrt 上界拆成一个可单独攻击的随机 Cayley 图独立数命题。","supporting_reasons_zh":["问题定义可转成图论优化量 min_B(|B|+alpha(G_B))，适合用计算搜索、SAT/ILP、随机实验和证明助理做局部验证。","已有备注给出明确路线图：n^{3/4}、n^{2/3+o(1)}、(n log n)^{2/3}、n^{3/5+o(1)}，且说明随机 Cayley 图独立数界如何转化为 f(n) 上界；这降低了重构和推进的门槛。","目标 n^{1/2+o(1)} 与已知下界 n^{1/2} 匹配，说明问题可能有正确猜想和可检验的极值结构，而不是完全开放无路标的问题。","GPT-5.5 配合文献检索和形式化工具，较适合整理散落评论中的 Hunter 论证、检查 BSS00/AlPh25 的适用条件，并把非正式推论变成可审计证明。","小规模极值搜索可以帮助判断最坏 B 的形态，例如随机型、区间型、稀疏差集型或伪随机 Cayley 型，从而给出有价值的研究反馈。"],"main_obstacles_zh":["核心目标似乎需要随机 Cayley 图独立数达到 p^{-1+o(1)} 的强界；这在备注中仍作为猜想出现，不是简单计算或形式化即可补齐。","加性结构导致边不独立，普通 Erdős-Rényi 图直觉可能失效；AI 若套用随机图独立数结论很容易产生错误证明。","f(n) 是极小化 |B|+alpha(G_B) 的全局极值问题，最坏 B 可能具有复杂伪随机结构，有限计算样本未必能外推到渐近上界。","现有上界含 o(1) 与对数项，证明细节可能依赖精细概率估计、傅里叶分析或容器方法，自动形式化成本较高。","如果需要突破 n^{3/5} 到 n^{1/2}，可能本质上是在推进一个独立的开放随机 Cayley 图问题，难度接近当前研究前沿。"],"validation_needed_zh":["严格核对从随机 Cayley 图独立数 alpha≪p^{-c-o(1)} 到 f(n)≤n^{c/(c+1)+o(1)} 的参数转换。","复现 f(n)≪(n log n)^{2/3} 与 f(n)≤n^{3/5+o(1)} 的证明依赖，确认区间、端点和 distinct-pair 条件没有遗漏。","用 ILP/SAT 或最大独立集算法计算小 n 的 exact f(n)，并记录极值 B 的结构。","检验 Adenwalla 的 f(n)≫n^{1/2} 构造是否可形式化，以及是否存在更强下界或对数因子。","若声称接近 n^{1/2+o(1)}，必须给出独立于经验计算的随机 Cayley 图独立数强界或新的组合论替代路线。"],"public_reasoning_summary_zh":"该题有清晰的图论重述、可计算的有限模型和已知上界链条，因此很适合 GPT-5.5 级模型做证明重构、参数审计、实验搜索和形式化验证。可是，JSON 中的备注已经表明想达到 n^{1/2+o(1)} 需要一个更强的随机 Cayley 图独立数猜想，因此模型直接完成最终猜想的希望有限。综合看，它不是低价值的纯前沿黑箱题，而是一个可被 AI 明显推进但未必彻底解决的中等候选。","not_a_solution_disclaimer_zh":"以上是 AI 可解性与推进潜力评估，不是该 Erdős 问题的解答，也不声称证明了新的上下界。"}