{"problem_number":"132","review_model":"GPT-5.5 with computation/formalization/literature/search tools","review_type":"one_problem_model_review","verdict_zh":"中等偏高候选：模型不应被预期直接解决完整一般情形，但有现实机会给出可验证的非平凡推进，例如扩大已知充分条件、建立新的结构性约化、做有限规模反例搜索与形式化验证，或证明若干自然点集类别中至少有第二个低重数距离。","level":"medium_candidate","score":67,"confidence":"medium","likely_route_zh":"最可行路线不是从零强攻一般定理，而是把距离重数图视为带几何可实现性约束的组合结构：先用计算搜索枚举小规模距离重数模式和疑似极端构型，再用代数/半代数约束排除不可实现模式；同时围绕“最大距离已至多出现 n 次”之外的第二个候选距离，尝试用凸包层、内部点数量、直径图结构、单位距离/重复距离上界等工具建立新的充分条件。形式化证明助手可用于核查有限分类、图论引理和边界情形。","supporting_reasons_zh":["问题表述短、目标明确，核心对象是有限点集的距离重数，适合计算枚举、反例搜索和证明检查协同工作。","已知备注显示存在多个局部结果：最大距离至多出现 n 次、n=5 和 n=6 成立、凸位置和某些非太凸情形成立；这说明问题有可分解的结构入口，而不是完全无抓手。","奖金说明中“any nontrivial result”降低了有意义成果门槛；GPT-5.5 级模型较可能产出新的条件性定理、有限规模验证或改进的证明组织。","若目标是第二个低重数距离，候选对象可从直径、凸包边/对角线、最稀有距离层、距离图补集等有限结构中系统搜索。","该问题可以被转化为若干可验证子命题：距离出现次数阈值、几何图边数、凸包层结构、可实现距离矩阵约束，这些都适合工具辅助。"],"main_obstacles_zh":["完整一般情形仍然开放，说明现有标准组合几何方法不足；模型很可能在关键结构引理上产生貌似合理但不成立的跳步。","反例搜索受实数几何可实现性影响很大，纯组合枚举出的距离重数模式未必能由平面点集实现。","距离相等约束形成高维代数系统，有限枚举很容易遇到坐标连续性、退化构型和同构去重问题。","第二个低重数距离的存在可能依赖全局几何结构，而不只是直径图或凸包边的局部性质。","“低重数距离数量趋于无穷”比“至少两个”强得多，可能需要接近当前前沿的距离问题技术，AI 单独完成的风险较高。"],"validation_needed_zh":["所有新引理都需要用严格组合几何证明核查，特别是涉及凸包层、直径图和平面距离图边数的部分。","计算搜索应记录枚举范围、一般位置/退化允许条件、坐标实现判定方法，以及是否只覆盖有理/整数/网格点集。","若给出有限 n 验证，需要可复现实验代码、独立随机测试、符号或数值稳定性检查，并最好转化为可审计证书。","若声称扩大凸位置或“not too convex”类结果，需要清楚说明新条件与问题 JSON 中已知条件的关系，避免重述已有结论。","形式化证明应优先覆盖有限分类、图论计数和阈值不等式；涉及真实平面几何的连续论证需额外人工审查。"],"public_reasoning_summary_zh":"从给定 JSON 看，这是一道开放的离散几何问题，已有结果覆盖直径、很小 n、凸位置和部分非凸情形。GPT-5.5 级模型配合工具最有希望做的是把问题拆成可搜索和可验证的结构子问题，寻找新的充分条件或排除小规模极端构型。完整证明“任意 n 点总有第二个至多 n 次出现的距离”仍属高风险；更强的“这样的距离数量趋于无穷”风险更高。因此评价为中等偏高候选，重点在显著推进而非可靠一次性完结。","not_a_solution_disclaimer_zh":"以上不是该 Erdős 问题的解答，也不声称证明了任何新数学结论；它只是基于给定 problem JSON 对 GPT-5.5 级工具增强模型可攻性与验证路径的审查。"}