{"problem_number":"743","review_model":"GPT-5.5-level model with computation, formalization, literature search, and counterexample-search tools","review_type":"one_problem_model_review","verdict_zh":"不宜判断为可直接完整解决；更合理的判断是：GPT-5.5 级别模型有中等偏低到中等概率在有限规模验证、结构化反例搜索、特殊树族推广、证明草案检查和形式化已有部分结果方面取得实质推进，但要独立完成 Gyárfás 树打包猜想的全量证明，当前看仍属低概率。","level":"low_to_medium_candidate","score":42,"confidence":"medium","likely_route_zh":"最现实路线不是直接证明原猜想，而是把问题转化为可计算的边不交嵌入/分解搜索框架：对小 n 做 SAT/ILP/CP-SAT 穷举或同构约简验证；对极端结构如星、路径、高度不平衡树、有限最大度树族建立可形式化的归纳或吸收式证明片段；围绕 remarks 中已有结果之间的缺口，尝试证明新的中间情形，例如混合高最大度和低最大度树序列的可打包性。","supporting_reasons_zh":["问题是可证伪型组合猜想，适合反例搜索、SAT/ILP 建模、同构剪枝和有限 n 机器验证。","已知结果覆盖若干重要特殊情形：星/路径、小规模 n≤9、部分贪心打包、 bounded maximum degree、最大度至 c n/log n，以及最大 cn 棵大树；这些给 AI 提供了明确的技术支点。","问题陈述短、对象离散、约束清楚，比较适合形式化建模和自动化检查。","若目标从完整解决降为显著推进，AI 可以在新特殊族、计算验证范围、候选反例排除、证明辅助形式化方面发挥作用。"],"main_obstacles_zh":["完整猜想涉及任意树序列的全局边分解，局部嵌入选择之间强耦合，搜索空间随 n 急剧爆炸。","remarks 显示已有进展使用了较深的图打包技术；剩余缺口很可能不是简单计算或短归纳能覆盖。","高最大度树、不同规模树之间的相互干扰、以及必须精确覆盖 K_n 全部边，都会使通用证明非常困难。","当前未形式化，若要机器验证新证明，需要先建立树嵌入、边不交打包、完全图分解等较多基础库。"],"validation_needed_zh":["实现独立的 SAT/ILP/CP-SAT 编码，并用已知 n≤9 结果作为回归测试。","对生成的所有树序列使用同构约简，验证搜索没有遗漏等价类。","若提出新特殊情形证明，需要用 proof assistant 或至少机器可检查的组合引理库验证关键归纳、交换和嵌入步骤。","需要将任何计算性结论与数学证明区分：有限 n 验证只能提供证据或排除小反例，不能替代一般性证明。","若声称推进 remarks 中已有边界，应逐条核对其假设是否真正超过已有结果，而不是重新证明已知特例。"],"public_reasoning_summary_zh":"这个问题结构清晰且可计算建模，因此 AI 工具链能有效做反例搜索、有限验证和特殊情形证明辅助；但它是著名树打包猜想，已有部分结果覆盖面广且技术含量高，剩余一般情形很可能需要新的组合思想。综合看，AI 完整解决的把握不高，但作为研究助手推进局部结果或验证证明片段有实际价值。","not_a_solution_disclaimer_zh":"以上不是该 Erdős 问题的解答，也不声称证明或否定该猜想；只是基于给定 JSON 对 GPT-5.5 级别模型可推进性的审查判断。"}