{"problem_number":"888","review_model":"GPT-5.5","review_type":"one_problem_model_review","verdict_zh":"中等候选：GPT-5.5 级别模型很可能不能可靠地直接给出完整渐近解，但有较好机会在构造、有限计算、形式化验证和上界框架整理上取得可审计推进。","level":"medium_candidate","score":63,"confidence":"medium","likely_route_zh":"可行路线是把每个整数按平方因子剥离后的平方自由核表示为向量，将条件转化为 GF(2) 上的奇偶关系和乘法比例约束；先用 SAT/ILP/最大独立集或超图搜索计算 A387584 的更多项，寻找极值结构；再形式化验证 primes、semiprimes 等构造满足条件，并尝试推广到受控素因子个数的集合；上界方面可把违规四元组建成稀疏超图，结合筛法、加性组合/乘法能量和容器方法尝试把已有 o(n) 推进到更接近 n log log n / log n 的量级。","supporting_reasons_zh":["题目条件具有明确的代数编码：abcd 为平方等价于四个平方自由核的异或和为零，这适合计算搜索、SAT/ILP 建模和形式化证明。","已有备注给出非平凡上下界：o(n) 上界与 semiprimes 下界之间仍有明显空隙，模型可以围绕这个空隙提出可检验的中间命题。","formalized=yes 说明至少存在形式化入口，适合让模型做定义等价变换、有限 case 验证、构造正确性证明和反例检查。","OEIS 条目存在，说明小 n 数据可能可扩展；模型配合程序可生成更多极值样本来辅助猜测结构。","构造侧比完整上界更可控，primes 和 semiprimes 的正确性证明短而结构化，模型有机会推广或排除若干自然候选族。"],"main_obstacles_zh":["完整答案很可能需要精细的乘法组合数论，而不仅是局部搜索或形式化验证。","从 o(n) 上界推进到匹配 semiprime 级别下界，需要控制大量由平方自由核关系诱导的四元约束，技术难度较高。","有限计算可能强烈受小 n 偏差影响，极值集合结构未必稳定外推。","形式化证明可以验证候选论证，但不能自动提供关键筛法或容器论证。","备注中的已有证明与评论未在本 JSON 中展开，因此任何复现或改进都必须额外进行文献/评论核验后才能算作可靠进展。"],"validation_needed_zh":["复现并形式化验证 primes 与 semiprimes 构造确实满足条件。","编写独立搜索程序，计算更多 n 的最大值或强上下界，并用第二种方法交叉验证。","把条件等价转换为平方自由核向量关系，并在证明助手中验证该转换无遗漏，尤其是 a≤b≤c≤d 与重复元素情形。","若提出新构造，需要自动枚举小范围反例并给出一般证明。","若提出新上界，需要与已知 o(n) 论证逐行比对，并检查所有筛法误差项和常数依赖。"],"public_reasoning_summary_zh":"这个问题不是纯定义展开题，而是带有清晰代数结构的开放极值数论问题。AI 的优势在于把平方条件编码成可计算对象、扩大实验数据、验证自然构造、整理已有 o(n) 证明并尝试局部改进；劣势在于完整渐近式大概率依赖深层筛法或乘法组合论。综合看，它适合作为“显著推进或验证”的候选，但不应高估为短期可完全解决。","not_a_solution_disclaimer_zh":"以上是对 GPT-5.5 级别模型可推进性的审查，不是该 Erdős 问题的解答，也没有声称给出最优上界、下界或完整渐近公式。"}