{"problem_number":"455","review_model":"GPT-5.5 + tools","review_type":"one_problem_model_review","verdict_zh":"低到中等候选：模型较可能给出计算性证据、形式化等价改写、有限范围验证和若干条件性推进，但独立证明原命题的概率不高。","level":"low_to_medium_candidate","score":43,"confidence":"medium","likely_route_zh":"可行路线是把条件改写为素数序列的凸性/非降间隔问题，搜索是否存在 q_n=O(n^2) 的长有限构造；同时用筛法、素数间隙统计和凸序列约束建立更强的有限或条件性下界。形式化工具可验证递推不等式、有限搜索结果与已知 Richter 型下界的推导片段。","supporting_reasons_zh":["问题陈述很短，结构清晰，形式化状态为 yes，适合模型把目标拆成凸性、间隔增长和素性约束几个可验证子问题。","已有备注只给出 liminf q_n/n^2 的正下界，说明至少存在可追踪的历史方法；模型可尝试复现并改进常数或条件。","反例搜索相对明确：寻找很长的素数凸子序列且 q_n/n^2 保持有界，可用整数规划、动态规划、SAT/SMT、素数表和启发式搜索支持。","即使不能解决极限为无穷，也可能显著推进有限版本，例如给出更长无反例区间、改进可形式化的下界或发现极端构造模式。"],"main_obstacles_zh":["原命题要求排除所有无限素数凸序列的二次增长上界，超出单纯有限计算能够直接证明的范围。","若存在接近二次增长的长有限构造，计算实验可能误导；需要把经验规律提升为筛法或密度论论证。","素数分布中的相关性和可选择子序列自由度很强，常规素数间隙估计未必足以控制这类自适应构造。","备注中的已知结果只是正的 liminf 下界，距离证明比任意常数 n^2 都大仍有本质差距。"],"validation_needed_zh":["复核形式化版本与此 JSON 陈述完全一致，包括下标起点、间隔条件是否从 n>=2 开始、极限含义。","检索并核对 Richter 1976 证明，确认 0.352... 下界依赖的关键引理和是否有后续改进。","实现独立有限搜索，记录最长可构造序列、q_n/n^2 的最小/稳定行为，并用可复现代码验证素性与间隔单调性。","若模型提出证明，需要用 Lean/Isabelle 或至少逐步机器检查核心不等式、筛法估计和所有量词转换。","对任何计算性反例候选，需使用确定性素性证明而非概率测试。"],"public_reasoning_summary_zh":"这个问题的 AI 可攻性来自其低表述复杂度和强形式化/计算入口：非降素数间隔可以转化为凸序列约束，有限搜索与证明检查都很自然。但核心难点是从有限或平均素数分布信息推出无限排除结论。GPT-5.5 级模型可能有能力组织搜索、复现已知下界、提出条件性定理或改进有限证据；要完整解决开放命题，则很可能需要新的数论思想，而不只是更强计算。","not_a_solution_disclaimer_zh":"以上是对 AI 辅助可解性与推进潜力的审查，不是该 Erdős 问题的证明或反例。"}