{"problem_number":"1144","review_model":"GPT-5.5 + tools","review_type":"one_problem_model_review","verdict_zh":"有一定希望显著推进，但不应预期一次性完全解决。该题处在随机完全乘法函数部分和的精细几乎必然下界问题上；给定 JSON 已显示已有接近平方根尺度乘对数的上界，但目标是证明归一化量的几乎必然无界性，方向上更像需要新的概率数论下界机制。GPT-5.5 级别模型可用于整理等价形式、检验候选二阶矩/块独立策略、做数值实验和形式化局部引理，但独立完成严格证明的概率偏低。","level":"low_to_medium_candidate","score":42,"confidence":"medium","likely_route_zh":"较现实的路线是把问题转化为随机变量族 S(N)=sum_{m<=N}f(m) 的多尺度下界问题，先计算或符号化验证其二阶矩、协方差结构和稀疏尺度上的相关性，再尝试构造近独立的区间或 Dirichlet 多项式事件，配合 Paley-Zygmund、Borel-Cantelli、截断 Euler product、鞅或高矩估计来证明在无限多个 N 上 S(N) 超过任意固定倍数的 sqrt(N)。工具可辅助搜索失败点：哪些尺度相关性过强、哪些矩估计不足、是否可从已知上界的证明技术反向提取可用分解。","supporting_reasons_zh":["问题陈述短、对象明确，随机性完全由素数上的独立 Rademacher 变量给出，适合模型和计算工具推导协方差、矩、条件期望和候选停时结构。","目标只要求 limsup S(N)/sqrt(N)=infty，而不是精确阶或最优常数；这比完整确定几乎必然增长率更弱，理论上可能通过稀疏尺度上的概率下界完成。","备注中已有几乎必然上界 S(N) << N^{1/2}(log N)^{1+o(1)}，说明平方根尺度附近的控制框架存在；AI 可检查该类框架是否也暗含或可改造成下界。","计算实验可以直接采样素数符号并快速评估 S(N)/sqrt(N) 的峰值增长，用于排除明显错误猜想、发现合适尺度和生成可证明的启发式。","形式化证明工具可验证基础恒等式，例如 E[f(n)f(m)] 的平方条件、二阶矩展开、有限 N 截断模型与无限模型的一致性，从而降低局部推导错误。"],"main_obstacles_zh":["核心困难是强相关性：f 是完全乘法函数，S(N) 不是独立随机游走，常规 LIL 或独立块 Borel-Cantelli 不能直接使用。","几乎必然的无限次大偏差下界通常需要足够强的反相关或准独立事件；在乘法结构下，不同 N 的事件高度耦合，证明无界 limsup 可能非常脆弱。","若仅有二阶矩或单尺度概率下界，通常不足以推出几乎必然无限次发生；需要高矩、相关事件控制或构造特殊尺度。","备注中的上界接近目标尺度，但上界方法未必提供下界；从上界技术反推下界存在较大不确定性。","该问题没有形式化版本，文献背景也只在 JSON 中给出极少信息；若严格遵守本次输入限制，不进行外部文献检索，则无法确认已有最新技术边界。"],"validation_needed_zh":["验证所有基础矩公式，特别是 E[f(n)f(m)] 非零当且仅当 nm 为平方，以及由此得到的 Var(S(N)) 精确或渐近规模。","在多个稀疏尺度上数值采样 S(N)/sqrt(N)，检查峰值是否随 log 或 log log 尺度缓慢增长，并记录有限样本偏差。","测试候选证明中的事件相关性估计，尤其是 P(S(N_i)>A sqrt(N_i), S(N_j)>A sqrt(N_j)) 是否足以支持二阶 Borel-Cantelli。","若使用 Dirichlet 多项式或 Euler product 截断，需要验证截断误差在几乎必然意义下可控，而不只是均值或概率意义下可控。","任何 AI 生成的证明草案都应由人工专家逐行审查，并尽量把关键概率不等式和有限模型极限过渡形式化。"],"public_reasoning_summary_zh":"该题的可攻性来自对象定义简单、随机源独立、目标为弱下界性质；困难来自完全乘法性造成的长程相关和几乎必然无限次事件控制。GPT-5.5 配合计算和形式化工具很可能能给出有价值的矩结构、实验启发、候选引理和反例式压力测试；但要把这些推进为完整证明，需要突破相关性控制这一核心障碍。因此评为低到中等候选，而不是高候选。","not_a_solution_disclaimer_zh":"以上是对 AI 可解决性和研究推进潜力的审查，不是该 Erdős 问题的证明或反证。"}