{"problem_number":"312","review_model":"GPT-5.5","review_type":"one_problem_model_review","verdict_zh":"中等偏低候选。该问题结构清晰、已形式化，且适合用计算搜索、极值构造和证明助理检查局部引理；GPT-5.5 级别模型有机会显著推进，例如找到更强的多项式误差、识别潜在极端构造、或把若干归约形式化。但直接证明指数级误差界 1-e^{-cK} 很可能需要新的加性组合或单位分数结构洞察，完成整题的概率不高。","level":"low_to_medium_candidate","score":42,"confidence":"medium","likely_route_zh":"可行路线是把问题转写为带特殊权重 1/n 的子集和逼近问题：先用计算和整数规划搜索对给定 K、最大分母、重数约束下的最坏多重集；再尝试把极端样例归纳为结构性障碍；随后证明若 A 的倒数和很大，则其某些尺度块的子集和在 1 附近形成足够细的网，或用随机选择、贪心修正、分块压缩、密度增量等方法把已知 c/K^2 型误差推进到更快衰减。形式化证明可用于验证分块引理、子集和覆盖引理和有限搜索证书。","supporting_reasons_zh":["问题陈述短、量词和目标明确，适合拆成可验证的组合引理，而不是依赖复杂定义体系。","权重具有特殊形式 1/n，比一般实数子集和更有算术结构，可能允许按分母尺度、可整除性或 Egyptian fraction 方法进行归约。","已知结果达到 c/K^2，说明存在非平凡证明框架；AI 可以尝试强化其中某些步骤或自动搜索瓶颈。","计算工具可以有效探索有限模型：固定分母上界、重数、总倒数和后，用动态规划或 MILP 寻找最差可达子集和缺口。","formalized=yes 增强了验证潜力：即使不能发现完整证明，也能把候选引理、反例证书或有限归约交给证明助理核验。"],"main_obstacles_zh":["目标误差是 e^{-cK}，相对已知 c/K^2 提升很大，可能需要本质新思想。","A 是任意足够大的有限多重集，允许高度重复和非常不均匀的分母分布，极端构造空间很大。","“sufficiently large” 的含义依赖 K，证明需要处理渐近量词，有限计算不能直接覆盖全体情形。","子集和逼近 1 同时要求不超过 1，不能只证明存在接近 1 的随机和；需要精细控制上溢和修正项。","如果存在反例族，可能需要很大规模或精心设计的分母结构，普通搜索不容易发现。"],"validation_needed_zh":["复核已形式化陈述是否与给定 Problem JSON 完全一致，尤其是多重集、子集、sufficiently large 和 K>1 的表达。","对小到中等 K 和有限分母范围运行独立 DP/MILP 搜索，记录最坏缺口随 K 的经验衰减。","检查任何候选证明是否真正给出统一常数 c>0，而不是依赖 K 或依赖 A 的隐含常数。","对分块覆盖、贪心逼近、随机选择等关键引理做形式化或至少机器可检查证明。","若提出反例方向，需要生成可复现的构造族并证明其倒数和、规模和所有可达子集和缺口性质。"],"public_reasoning_summary_zh":"这是一个高结构但高难度的单位分数子集和问题。GPT-5.5 配合工具最现实的贡献不是直接闭合公开问题，而是系统搜索极端例、强化已有多项式近似界、提出可形式化的中间引理，并验证有限或条件性结果。指数级逼近要求非常强，因此我把它评为 low_to_medium_candidate，而不是高候选。","not_a_solution_disclaimer_zh":"以上是 AI 可解性与推进潜力评估，不是该 Erdős 问题的解答，也未声称证明或反驳命题。"}