{"problem_number":"474","review_model":"GPT-5.5","review_type":"one_problem_model_review","verdict_zh":"低候选。该题是集合论分割关系与 forcing/一致性强度问题，目标不是单一构造或有限反例，而是判定在哪些集合论假设下 2^{aleph_0} 不满足或满足三色的 aleph_1 分割性质。GPT-5.5 级模型配合文献检索、形式化证明和反例搜索，较可能整理已知结果、验证 CH 情形和若干弱化命题，并生成可检查的 forcing 方案候选；但直接解决剩余的一致性问题，尤其是 remarks 中指出的 c=aleph_2 情形，成功概率较低。","level":"low_candidate","score":22,"confidence":"medium","likely_route_zh":"最现实路线是先把命题精确化为分割关系 2^{aleph_0} \\not\\to [aleph_1]^2_3 与其正向版本，重建已知的二色定理、CH 下三色负例，以及 Shelah 一致性正例的证明框架；随后尝试围绕 c=aleph_2 的模型构造或 preservation 分析提出候选 forcing，并用小规模 combinatorial analogues、proof assistant 形式化核心引理、以及文献检索来排除重复或错误路线。","supporting_reasons_zh":["题目已给出若干明确锚点：二色情形已知、CH 下负向答案已知、非 CH 且大连续统下正向答案一致，这使模型可以围绕现有证明进行重建和局部验证。","该问题属于高结构的集合论/Ramsey 分割关系，很多工作可被拆成可审计子任务：符号化命题、检查 cardinal arithmetic 条件、追踪 forcing 是否保持 aleph_1、分析 colouring construction。","配合文献检索时，模型可能显著推进综述性判断：定位 Shelah 结果与 c=aleph_2 问题之间缺口，提出具体需要证明或反驳的 preservation lemma。","若目标降低为验证已知情形或形式化部分引理，GPT-5.5 级模型有一定可行性，尤其是在 proof assistant 中形式化基本分割关系和 CH 下构造。"],"main_obstacles_zh":["核心剩余问题看起来是独立性/一致性层面的 forcing 问题，不是有限搜索或计算实验能直接解决的对象。","c=aleph_2 情形可能需要非常精细的 forcing、迭代、preservation 与 partition-calculus 技术；模型生成的证明草图很容易在保持基数、链条件、stationarity 或 colouring-universality 处出错。","题目要求的是“在哪些集合论假设下成立”，完整答案可能需要双向一致性、相对一致性强度或不可判定性分析，验证成本高。","形式化证明系统对高级 forcing 与现代集合论库支持有限，形式化工具更适合局部检查，难以替代专家级元数学判断。"],"validation_needed_zh":["逐条核对已知结果的精确表述：二色情形、CH 下三色情形、Shelah 的正向一致性结果，以及连续统大小条件。","对任何新 forcing 候选，需要验证其链条件、是否保持 aleph_1、连续统最终大小、以及目标分割关系是否真的成立或失败。","若模型声称解决 c=aleph_2 情形，必须由集合论专家审阅完整证明，并最好给出机器可检查的关键 combinatorial lemma 或 forcing-preservation 子证明。","需要排查是否只是重述了已有结果、是否改变了题目中的 unordered/ordered pair 或 A^2 解释、以及 colour-pair 条件是否与分割关系符号完全等价。"],"public_reasoning_summary_zh":"从给定 JSON 看，这是一道集合论假设依赖型问题：已知 CH 给出负向三色结果，某些非 CH 大连续统模型给出正向一致性结果，但 c=aleph_2 的关键情形仍被标为开放。AI 工具链最有价值的作用是重建、检索、局部形式化和压力测试候选证明，而不是通过 brute force 搜索解决。由于剩余难点集中在高级 forcing 和相对一致性证明，完成全题的概率低，但产生有用的结构化综述、验证已知边界、提出可供专家检查的新路线仍有一定价值。","not_a_solution_disclaimer_zh":"这不是该 Erdős 问题的解答，也没有声称给出新的集合论一致性结果；这里只评估 GPT-5.5 级模型在工具辅助下可能完成、推进或验证该问题的可行性。"}