{"problem_number":"589","review_model":"GPT-5.5+tools","review_type":"one_problem_model_review","verdict_zh":"可作为中等偏低候选：模型较可能复现、核验并局部改进现有证明框架中的技术环节，但不应预期直接给出真正的渐近估计或闭合已知的 n^{1/2}log n 与 n^{5/6+o(1)} 间隙。","level":"low_to_medium_candidate","score":42,"confidence":"medium","likely_route_zh":"把点集的三点共线关系编码为3一致超图；“无四点共线”限制每条直线最多贡献一个三元边族结构，目标子集对应超图独立集。模型可尝试结合概率方法、超图容器、半随机构造、有限域/网格型配置、计算搜索和形式化验证来复查下界 n^{1/2}log n、理解上界构造 n^{5/6+o(1)}，并寻找改进某些对数因子或特殊配置族的机会。","supporting_reasons_zh":["题面给出了明确的已知区间：平凡贪心得到 n^{1/2}，Füredi 下界改进到 n^{1/2}log n，上界已到 n^{5/6+o(1)}；这为工具辅助复现和验证提供了清晰目标。","问题可自然转化为共线三元组超图的独立数问题，适合用计算枚举、SAT/ILP、小规模反例搜索、随机构造实验和形式化证明检查来辅助分析。","现有结论同时涉及密度 Hales-Jewett、极值几何和超图方法，说明该问题有成熟技术入口，模型可以通过文献检索和证明拆解显著推进理解层面的工作。","若目标降低为验证已知界、寻找特殊点集族的更好估计、或机械化某个证明片段，GPT-5.5级模型配合工具有现实成功概率。"],"main_obstacles_zh":["核心未知是渐近估计而非单一计算实例；现有上下界差距为幂级差距，通常需要新的结构性思想。","上界依赖深层组合构造或定理，题面提到 density Hales-Jewett 及后续改进；模型很难凭局部推理可靠地产生可发表的新全局构造。","几何可实现性是额外难点：任意3一致超图模型不一定能由平面点集的共线关系实现，计算搜索得到的候选结构必须回到实几何中验证。","下界若要突破现有量级，可能需要对所有无四点共线配置给出统一控制，单靠随机采样或有限规模实验通常不足。"],"validation_needed_zh":["逐条复核 Füredi 下界 n^{1/2}log n 的假设、常数依赖和是否正好适用于“无四点共线”的平面点集。","复核 Balogh-Solymosi 上界 n^{5/6+o(1)} 的构造是否与题中 g(n) 定义完全一致，包括 no four on a line 条件。","若模型提出新界，需要给出从点集到超图再回到几何实现的完整证明，不能只证明抽象超图版本。","对任何计算发现，应记录生成点集、共线三元组、最大一般位置子集的可复现实验，并用独立程序或形式化系统交叉验证。","若声称改进已知结果，应做文献检索确认没有被已有工作覆盖；但本次判断仅基于给定 problem JSON，未额外检索。"],"public_reasoning_summary_zh":"这个问题的形式简洁，适合模型用工具做证明重构和实验探索；但题面给出的已知进展显示它连接深层组合几何与极值理论，且仍有很大的幂级上下界间隙。因此 GPT-5.5 级模型最现实的价值是验证现有结果、整理可形式化路线、搜索特殊构造和提出可检验猜想；直接完成“Estimate g(n)”的概率较低。","not_a_solution_disclaimer_zh":"以上不是该 Erdős 问题的解答，也不声称改进已知界；它只是基于给定 JSON 对 GPT-5.5+工具可能贡献的可行性评估。"}