{"problem_number":"619","review_model":"GPT-5.5 级别模型配合计算、形式化证明、文献检索与反例搜索工具","review_type":"one_problem_model_review","verdict_zh":"中等偏低到中等候选。该问题是有限图论中的具体极值型断言，局部三角形约束和直径约束都可精确编码，因此 GPT-5.5 级别模型很可能能做出有价值的计算探索、形式化定义、候选构造筛查和若干结构性引理验证；但要给出对所有连通无三角图成立的线性改进常数，仍可能需要新的组合洞察，完整解决的把握不高。","level":"low_to_medium_candidate","score":52,"confidence":"medium","likely_route_zh":"可行路线是先把 h_4(G) 形式化为在补图中选择新增边集 F，使 G+F 无三角形且直径至多 4 的最小化问题；用 SAT/ILP/CP-SAT 对小规模连通无三角图精确求 h_4(G)，寻找极端结构；同时从 BFS 分层、支配集/独立支配集、中心点增边策略等角度尝试证明存在某个固定节省比例 c。若计算发现接近 n 的族，则转向构造无限反例并证明下界；若未发现，则将候选构造算法和关键支配型引理交给证明助手逐步验证。","supporting_reasons_zh":["问题对象有限且定义清晰：连通图、无三角性、增边、直径约束都适合精确程序化建模。","目标只要求存在某个常数 c>0，而不是最佳常数；这降低了证明所需精度，允许粗粒度结构分解或充电论证。","备注中已有 h_3、h_5 以及去掉无三角保持条件时的相关上界，可为构造性增边策略提供局部模板。","无三角保持条件本质上是局部约束，新增边是否合法可通过共同邻居和新增边之间的三角形约束检查，适合反例搜索和形式化验证。","若存在小规模极端图，自动枚举和精确优化有较大机会发现模式；若不存在，也能为猜测常数和证明路线提供审计证据。"],"main_obstacles_zh":["核心断言是对所有 n 和所有连通无三角图的统一线性上界，小规模计算不能直接推出一般情形。","多条新增边之间会相互产生新的三角形约束，不能只逐边检查原图中的共同邻居，优化问题具有非线性交互。","最坏情况可能来自稀疏、树状、二部图或特殊分层结构，常规随机搜索可能很难命中。","已知 h_3 和 h_5 结果不能直接插值出 h_4；保持无三角的直径 4 情况正是困难点。","当前 problem JSON 标注未形式化，若要机器验证，需要先建立图、直径、增边最小值和无三角保持的完整形式化框架。"],"validation_needed_zh":["澄清 h_r(G) 中“diameter r”是否按备注实际意图理解为“diameter at most r”，并确认问题中的 G 隐含为连通无三角图。","实现精确求解器，枚举小 n 的连通无三角图，计算 h_4(G) 并记录达到最大值的结构。","用同一建模复现备注中的已知类型上界在小实例上的表现，验证编码没有误解直径或三角形约束。","对候选证明路线中的关键组合引理进行独立证明检查，最好在 Lean/Isabelle 或可审计的图论形式化框架中验证。","若出现反例候选族，需要证明其对无限多个 n 成立，并给出 h_4(G) 的严格线性下界，而不只是计算样本。"],"public_reasoning_summary_zh":"这个问题对 AI 工具链友好的地方在于它可以被精确转化为有限约束优化，并且只需证明一个非最优的线性节省常数；因此反例搜索、结构猜测和局部引理验证都很有希望。困难在于最终需要一个全体连通无三角图上的统一组合证明，新增边之间的三角形相互作用也会破坏简单的贪心论证。综合来看，GPT-5.5 级别模型不应被预期稳定独立完成完整解决，但有较现实的机会显著推进问题、验证候选常数策略或排除若干极端族。","not_a_solution_disclaimer_zh":"以上是 AI 可解性与推进潜力评估，不是该 Erdős 问题的证明、反例或结论真假的断言。"}