{"problem_number":"544","review_model":"GPT-5.5","review_type":"one_problem_model_review","verdict_zh":"低到中等候选：GPT-5.5 级别模型较可能对该问题做出有价值推进，例如整理等价形式、验证已知上界推论、探索随机图/半随机构造下的启发式和有限 k 数据，但直接证明两个断言中的任一核心开放部分的概率不高。第一问“相邻 Ramsey 数差趋于无穷”看似弱于精确渐近，但仍要求控制 R(3,k) 的局部增量，现有全局渐近不足以推出；第二问 o(k) 更接近精细渐近/稳定性问题，难度更高。","level":"low_to_medium_candidate","score":38,"confidence":"medium","likely_route_zh":"可行路线不是暴力求解，而是把问题转化为对三角形自由图独立数阈值的局部稳定性问题：研究 n 从 R(3,k)-1 增至 R(3,k+1)-1 时最大三角形自由图的独立数如何变化；结合已知 R(3,k) 渐近、容器方法、随机图过程或半随机 Ramsey 构造，尝试证明更强的局部平滑性或排除长时间停滞。工具层面可让模型系统检索相关文献、形式化已有推论、生成候选引理，并用 SAT/ILP/图搜索验证小 k 或构造反例模式。","supporting_reasons_zh":["题目陈述短、目标明确，适合模型进行问题重写、等价命题提取和证明路线枚举。","给定备注已经提供关键全局信息 R(3,k) 渐近为 k^2/log k，以及一个非平凡相邻差上界，这为 AI 推导可验证的弱结论和寻找缺口提供了入口。","第一问只要求差值趋于无穷，目标比精确估计弱，理论上可能由新的局部平滑性或稳定性引理推出。","计算工具可以穷举或约束求解小规模 R(3,k) 周边实例，帮助发现相邻差的经验规律和潜在障碍。","形式化证明工具适合验证从已有定理到若干中间推论的逻辑链，降低模型在渐近不等式处理上的错误率。"],"main_obstacles_zh":["全局渐近 R(3,k) ~ k^2/log k 本身不能推出相邻差趋于无穷；函数可有剧烈局部波动，因此需要额外结构性信息。","相邻 Ramsey 数差涉及 Ramsey 阈值的局部行为，远比平均增量 R(3,k)/k 细。","第二问 R(3,k+1)-R(3,k)=o(k) 与更精细的常数、误差项和构造极值图行为相关，当前给定信息不足以直接攻击。","小 k 计算数据对渐近问题支持有限，且 Ramsey 数计算很快变得不可行。","AI 生成的新容器法、随机过程或极值图稳定性论证很容易出现不可见漏洞，需要专家级审查。"],"validation_needed_zh":["检索并核对备注所指文献中 R(3,k) 渐近、OpenAI bound 及其对相邻差上界的精确适用条件。","检查任何声称推出差值趋于无穷的论证是否真的排除了 R(3,k) 在无限多个 k 上相邻差有界的可能。","若提出 o(k) 证明，需要明确给出强于当前备注上界的局部估计，并验证常数和误差项不会依赖错误。","对计算实验，需要记录编码方式、SAT/ILP 证书、图同构去重和不可满足性证明，避免只报告启发式搜索结果。","若使用形式化证明，应至少形式化关键渐近推导、单调性步骤和从图论定义到 Ramsey 数差的等价转换。"],"public_reasoning_summary_zh":"该问题的难点在于从 R(3,k) 的全局增长率转向相邻项的局部增量。平均意义上 R(3,k) 的增长很大，但这并不自动保证每一步增长都变大；而 o(k) 更要求相邻增量远小于线性量级。GPT-5.5 配合工具很适合做文献整合、有限实例验证和候选引理筛选，也可能发现一个可投稿的部分结果或条件性结论。但要完整解决开放断言，尤其是第二问，需要新的 Ramsey 理论结构性洞察，不能主要依赖计算或形式化检查。","not_a_solution_disclaimer_zh":"以上是对 AI 辅助可推进性的审查，不是该 Erdős 问题的证明或反例。"}